{
  "fact_set_id": "FS-VIDEOACCOUNT-E2E01-0001",
  "fact_type": "VIDEO_ACCOUNT_FACTS",
  "brand_id": "fixture-brand-01",
  "version": 1,
  "schema_version": "A-3.6-v2",
  "updated_at": "2026-08-18T16:30:00+08:00",
  "updated_by_role": "BRAND_OPERATOR",
  "account_id": "ACC-HXJ-001",
  "platform": "WECHAT_VIDEO",
  "account_name": {
    "status": "CONFIRMED",
    "value": "衡叙集·穿衣判断（虚构）",
    "source_refs": [
      {
        "source_id": "SRC-E2E01-0037",
        "brand_id": "fixture-brand-01",
        "source_type": "BRAND_OPERATOR_INPUT",
        "locator": "数据包 包5【模拟】",
        "captured_at": "2026-08-17T00:00:00+08:00",
        "checksum": null
      }
    ]
  },
  "positioning": {
    "status": "CONFIRMED",
    "value": "面向城市女性的服装选择与真实穿着决策账号：以商品事实、场景试穿和明确取舍，回答“为什么选、怎么穿、何时不选”",
    "source_refs": [
      {
        "source_id": "SRC-E2E01-0038",
        "brand_id": "fixture-brand-01",
        "source_type": "BRAND_OPERATOR_INPUT",
        "locator": "数据包 包5 定位【模拟】",
        "captured_at": "2026-08-17T00:00:00+08:00",
        "checksum": null
      }
    ]
  },
  "content_style": {
    "status": "CONFIRMED",
    "value": [
      "稳口吻、熟关系、低剪辑刺激；以一件商品或一个穿衣问题为单集单位，画面保留面料近景、正侧背面、动作和必要的事实卡；促销只作为业务事实，不作为内容主线"
    ],
    "source_refs": [
      {
        "source_id": "SRC-E2E01-0039",
        "brand_id": "fixture-brand-01",
        "source_type": "BRAND_OPERATOR_INPUT",
        "locator": "数据包 包5 内容风格【模拟】",
        "captured_at": "2026-08-17T00:00:00+08:00",
        "checksum": null
      }
    ]
  },
  "audience_relationship": {
    "status": "CONFIRMED",
    "value": "不是销售话术广播站，而是长期衣橱判断伙伴；欢迎观众提交通勤、久坐、身形变化、颜色尝试和门店试穿问题，并允许后续视频修正上一集判断",
    "source_refs": [
      {
        "source_id": "SRC-E2E01-0040",
        "brand_id": "fixture-brand-01",
        "source_type": "BRAND_OPERATOR_INPUT",
        "locator": "数据包 包5 与观众关系【模拟】",
        "captured_at": "2026-08-17T00:00:00+08:00",
        "checksum": null
      }
    ]
  },
  "primary_persona_ref": {
    "object_type": "PersonaFacts",
    "object_id": "FS-PERSONA-E2E01-R01",
    "version": 1,
    "brand_id": "fixture-brand-01"
  },
  "expression_boundaries": {
    "status": "CONFIRMED",
    "value": [
      "未核对款号、成分、尺码、价格和库存时不得下商品结论",
      "价格冲突必须同时展示并标记“待裁决”，不得选择性隐藏",
      "不把模特效果等同于所有人效果",
      "不使用焦虑、羞耻、年龄贬低或身材贬低推动成交",
      "不把私域关系简化为连续促销"
    ],
    "source_refs": [
      {
        "source_id": "SRC-E2E01-0041",
        "brand_id": "fixture-brand-01",
        "source_type": "BRAND_OPERATOR_INPUT",
        "locator": "数据包 包5 表达边界【模拟】",
        "captured_at": "2026-08-17T00:00:00+08:00",
        "checksum": null
      }
    ]
  }
}
